{
  "$schema": "./bench-matrix.schema.json",
  "outputDir": "bench-results",
  "runs": 2,
  "aggregate": {
    "percentiles": [50, 75, 95],
    "trimExtremesPercent": 0,
    "acceptableDeltaMs": 40,
    "metrics": ["eventTimingMaxMs", "wallClockMs", "searchTypingWallMs", "inpMs"]
  },
  "configurations": [
    {
      "id": "chromium-desktop",
      "label": "Chromium desktop 1280×720 headless",
      "env": {}
    }
  ],
  "playwrightArgs": []
}
